id,label,tweet,isVulgar,isNonAscii
5872,0,A bit of snow in the desert!! skidubai mydubai snow ski apple iphone excited video…,0,1
5875,1,“@kosmonatik: This new apple map app suckkkksssss ugh! apple maps” how do I downgrade? Back to iOS 5,0,1
5876,0,Lighting Overload! . . . . . christmas xmas christmastime chrristmaseve sony…,0,1
5879,0,"Birthday to my best friend & companion, my better half, apple of my eyes, the…",0,1
5881,0,to announce we will have our apple bourbon bacon jam on hand saturday …,0,1
5882,0,My new baby... laptop pink gadgets baby sony vaio instaday instagood instadaily…,0,1
5883,0,"Gilmore Girls Revival: Yup, Luke… news photography fashion health fail tech ipad iphone funny lol",0,1
5884,0,Budget 2016: A bare-minimum budget… news photography fashion health fail tech ipad iphone funny lol,0,1
5888,0,Anton Yelchin’s CAA Agent on His… news photography fashion health fail tech ipad iphone funny lol,0,1
5890,0,California HD Wallpapers now in Appstore CaliforniaDreaming CaliforniaGirl iPhoneWallpaper … IPhone,0,1
5896,1,“@prolly22389: Getting rid of google maps... One of apple 's worst decisions” no doubt. Didn't even turn it on.,0,1
5898,0,Love comes with great responsibility life rainbow horse photography picoftheday iphone …,0,1
5900,0,"I candles ! They make me relax and , sony camera cybershot water night , my…",0,1
5906,0,NorthKoreanHackers succeeded in getting Sony to pull TheInterview but they aren't . Here's proof: ?v=UEaKX9YYHiQ …,0,1
5910,0,New post workout photo adornthewicked apple spotify hardrock metal kick$&@*# music…...,0,1
5911,0,Morning selfie me model igers iphone igdaily instago igaddict instagood hot instamood…,0,1
5912,0,Gummibär I You iPhone Game App: Everybody’s favorite green animated gummy bear now…,0,1
5913,0,Hard Plastic Shaw... and much more at Zeta Supplies. Click the link - -plastic-shawn-mendes-case-for-iphone-5?utm_campaign=social_autopilot&utm_source=tweet&utm_medium=tweet … iPhone discount case,0,1
5915,0,Love to find pics of me! (not my pic) Ice cream time!! I missed it!! igers hull unitedkingdom icecream happiness smile iphone…,0,1
5921,0,Lights at the end of the tunnels * * iphone igdaily instago instagood instacool… -/,0,1
5923,0,My new phone! For a change! Gusto mo ba? Khlarie or Xyril? I am so happy! samsung …,0,1
5931,0,New entry traveldiary travelblogger photo traveljob selfiecam sony sonyalpha … pic.twitter.com/w56HxtMRNj,0,1
5935,0,Unadulterated love and innocence. siblings instalove igers iphone igdaily instagood pune…,0,1
5938,0,JAYZ Magna Carta Holy Grail -- Free DL for Samsung Galaxy users 1st! 4TH OF JULY…,0,1
5940,0,Jump into the Montreal life? Canada quebec summer trip girl view city travel observatoire360 observatoirepvm todayatapple iphonex Observatoire Place Ville Marie ?utm_source=ig_twitter_share&igshid=twh9w2qsdkuv …,0,1
5943,1,Leave It to Ikea to Show Us How Stupid Apple Is. .html … via Thank you ikea! :) bookbook,0,1
5946,0,Drink up. Awesome homemade soda chills great hospital soda yum iphone blondehair…,0,1
5956,0,My sexy girl stealing my GTA :-* . gamers sony ps3 chilling teamps3 couple cutie…,0,1
5961,0,Tonight in the Cirebon city cirebon photography canon iphone saturdaynight lowspeed…,0,1
5964,0,Retweeting : Smitten: • iphone iphoneography photo oldcamera unreleasedapp photography,0,1
5968,0,InstaFrame Bigbang really make my day.. :D holiday sembreak macbook apple gd gdragon…,0,1
5970,0,"~Nothing compares 2 U~ -HRk chriscornell iphoneX moon Puente Alto, Chile ?utm_source=ig_twitter_share&igshid=1vbvanmjhfc2j …",0,1
5972,0,"Me, Mom and Emily all got the same new phones on Dads new plan with sprint. It's called a motor 5 Google phone. Yay!!!! sprint motorola phones ?utm_source=ig_twitter_share&igshid=9l7c63rv6c97 …",0,1
5974,0,Repost of : “@marijnvinzenz is.. “ ?taken-by=marijnvinzenz … twitteranniversary find me apple wacom app artwork,0,1
5991,1,Don't make time for people that don't make time for you sad samsung galaxys3 galaxys4… -o8qVZA/,0,1
6000,0,Dessert is always a great idea! Try our apple crumble topped with ice cream . . . . eat.with.coco foxandfiddle dessert apple icecream toronto cravings summer sunshine… ?utm_source=ig_twitter_share&igshid=yys20wdllwky …,0,1
6003,1,Must have accidentally updated my iPhone and I’m so pissed. ScrewApple TakeMeBack,0,1
6005,0,Ils sont content . LizardSquad PSN XBOXLIVE Hack DamnIt TropLong Sony Microsoft…,0,1
6009,1,The detailed low-down on Apple's SSLvulnerability. Guess it's time to update my iPhone dammit -ssl-iphone-vulnerability-how-did-it-happen-and-what-next …,0,1
6011,1,Italy fines Apple over AppleCare for €200k for violating consumer laws even though Apple changed policies -fines-apple-again-over-applecare/ …,0,1
6012,0,Tree | water | sky | sunshine vocation newyear trip thailand khaoko a6000 ILCE6000 sony…,0,1
6013,0,The excitement is high!! Learn SLRDiGi Sony Photography BFF Family Celebration… -kc/,0,1
6015,0,RT: MissHijabi_MK: RT: monteithelgort: First post from my new phone samsung samsunggalaxy samsunggalaxys6 me new phone……,0,1
6018,0,Like and Share if you want this Diamond Case For Iphone 6 iphone ... .php/product/new-hot-fashion-luxury-diamond-case-for-iphone-6-4-7-inch-phone-cases-back-cover-for-apple-iphone-6s-case-accessories/ …pic.twitter.com/VgnknRspFX,0,1
6022,0,have a nice days Social life iphone7plus iphone apple fin netflixandchill net…,0,1
6023,0,new blog entry ProductTesting reviews Sony actipatch DontSuffer -of-a-better-week … via,0,1
6028,0,"Coming soon on MyCards, Barcode scanner for Ean Code, Aztec code, QR code and PDF417 code. ?at=1001lvuB&ct=TWPost-MyCardsLite … FidelityCards CarteFedeltà AppStrore Apple iPhoneX iPhone8 iPhone8Plus AARP Update Newspic.twitter.com/WtFINmxdJf",0,1
6034,0,samsungblast SamsungGalaxyNote7 mind it can smoke you to hell. blasting . killer …,0,1
6040,0,Free. Model: Photographer: Captured on: sonya7Rii Location: Lake Dolores Waterpark . . . sony sonyartisan lifestyle free goodtimes friday… ?utm_source=ig_twitter_share&igshid=1n7rl6m9hjgmr …,0,1
6047,0,She pretty pan any side abouttonight birthdayparty BOSS moi iPhoneX JustMe …,0,1
6052,0,thankyou! thanks dad mom it gift samsung galaxy grand white gadget android … -C-/,0,1
6053,0,Fantasy Manager Football 2015 - -fantasy-manager-football-2015-soberi-nepobedimuyu-komandu.html … Андроид Android Games News IOS Apple iPhone,0,1
6054,0,More treats for the hounds - Apple honey shortbread bites dog cookies healthyhound…,0,1
6057,0,The Kapil Sharma Show Latest Episode 60 Saturday 2016 sony birthday 19thNov …-kapil-sharma-show-latest-episode-60.html …pic.twitter.com/1eaC90P2UB,0,1
6060,0,If I lose myself tonight it will be by you and I. Apple guys guy boy Iphone boys … -LYFAA36/,0,1
6062,1,"So I bought my Xbox on Monday (5days ago), last night my TV brokedown sony Now I…",0,1
6067,0,Finally! A picture of me in Paris! There is a face behind the iPhone! parisianneforaweek …,0,1
6070,0,Ready for tonight! lasvegas salvadorean iphonex iphoneography host radio radiohost night club -q/?utm_source=ig_twitter_share&igshid=148qu9p0ppbte …,0,1
6076,0,"Oh my God, truth be told... men crazy iphone galaxy6 instamood kiss…",0,1
6077,0,I love you both. samsung live laugh life filchi chinese instamood instagood…,0,1
6092,0,Congratulations Hidayah! friends party chill engagement classmate smksm fisheye sony… -9y4AY/,0,1
6094,0,Love to find pics of me! (not my pic) korea 비플랫그램 pic photo good iPhone ly camera girl diet icecream greentea 다이...,0,1
6105,0,Proper car porn this weekend!! igs iphone nature igers photooftheday instadaily …,0,1
6108,0,To all our family and friends!! giftphotographyclub fish newyear 2015 sony a6000 vscocam…,0,1
6112,0,me friends like crazy lol model face Sony nice UAE UAEu AA kfn ...hhhhh be crazy…,0,1
6113,1,"my sundays, every sunday homework midterms suck giraffe onesie candle apple mac macbook…",0,1
6119,0,Smile x today dutch girl netherland brunette smile you softball adidas samsung…,0,1
6122,0,Eating Light. :) light christmas apple health graphicdesign art design food…,0,1
6129,0,Aruba aruba travel travelblogger blogger vacation holiday caribbean karibik onehappyisland experiences Sony connectingtravellers Check out my homepage for… -momAGvV/?utm_source=ig_twitter_share&igshid=1pn31h7jhycs5 …,0,1
6131,0,Wna 2shhhd kuwait q8ig iphone iphonesia indtsplus like cut pic ighype instamood q8 food,0,1
6132,0,The love of my life and I a picture in the dark with our new phones. Loving it IPhone…,0,1
6136,1,Analysts estimate that Apple will have put the letter ‘i’ in front of every word in the English language by 2019 ihateapple,0,1
6140,0,New Douglas sunglasses with moka iphone case. fashion style stylish me cute…,0,1
6141,0,"Just added Hard Plastic Shaw... to our collection of products, check it out here at -plastic-shawn-mendes-case-for-iphone-6?utm_campaign=social_autopilot&utm_source=tweet&utm_medium=tweet … iPhone case technology",0,1
6145,0,Happyness is a state of mind me selfie igers follow4follow cute beard apple earpods…,0,1
6149,0,Now Available - Sublimation Vest. Check it out here - -vest?utm_campaign=social_autopilot&utm_source=tweet&utm_medium=tweet … iPhone case music discount,0,1
6150,0,Mornings’ duckies x. sunday morningwalk iphonex besplendid california2018 Laguna…,0,1
6153,0,Gain Followers RT This MUST FOLLOW ME I FOLLOW BACK Follow everyone who rts Gain iphone sougofollow e9¤b,0,1
6155,1,Thug Life. thuglife doritos fuckyou idgaf monday swag ps3 sony callofduty videogames truth…,0,1
6158,0,"very with Apple for Refunding the Full £1,664 my little Scallywag had managed to accumulate playing an App. WhoWouldHaveKids",0,1
6163,0,My iPad minis background >>> ipadmini apple allen hangover middle finger candycrush…,0,1
6168,0,Grabaciones time auch. I it. Soccer Fútbol camera Sony yeah.,0,1
6177,0,The purpose of life is to live a life of purpose. MondayMotivation … … IPhone IPAD iOS MondayMotivation,0,1
6178,0,birthday Steve Jobs: how Apple disciples still worship the modern messiah…,0,1
6179,0,cadillac coupe ats monotone still so bling .. follow instagood photooftheday beautiful like4like summer fun igers instalike follow hdr iphonex luxury… -/?utm_source=ig_twitter_share&igshid=11bvsdiqsn4lo …,0,1
6182,1,apple is starting to suck…it just doesn't work when I need it to!,0,1
6183,0,Soul photography travel Italy Sony a7s film cinematography youtuber photo …,0,1
6185,0,Tonight's gig. birthday tasha with my rig kronos korg mainstage apple wayo…,0,1
6189,0,Source: NBC blue apple facebook girl girls girlpower eggs nbc tech news like…,0,1
6190,0,Let's have dessert fun monday bankholiday dessert iphone friends london londonlife…,0,1
6192,0,How do you see yourself? beautiful ugly sad 50mm sonyalpha sony woman women…,0,1
6193,1,even slower now! hateapple! i cant even unlock my iphone..its kind of responds but no display iOS9 Appleerror …,0,1
6196,0,The phone in the mirror is one of my presents :D bad cool phone samsung galaxyIII…,1,1
6199,0,"tbt to a Jubilation of daisies! alaska kindness beautiful jehovahscreation jwvisuals jw iphone flowers nature Anchorage, Alaska ?utm_source=ig_twitter_share&igshid=1wgoa4qrjxp08 …",0,1
6201,0,Bad mood since I lost my phone :( but I love my new phone :D iphone samsung sad …,0,1
6202,0,Thousands are switching from armbands to SlimClipCase.Find out what you are missing iPhone case apple fit …,0,1
6204,0,Finally a functional new phone to replace my old spoilt hp ;_; with own DIY casing (*^▽^*) samsung ...,0,1
6207,0,friend brother gear samsung iphone5 apple tatto work instamood instafollow …,0,1
6210,0,My phone samsung blackberry instagram dailyphoto instagrammers new now doubletap…,0,1
6214,0,Postcard from Lecco selfie selfienation lake landscspe me igdaily iphone6 iphone…,0,1
6218,0,Henry + Zhoumi are ! WeLoveHenMi (@nisahlee) • beautifulgirls + smartgirls can tweetforit (!) iPhone iPad Android,0,1
6219,0,"Ill try find the volume to turn it down, ive never used an iphone 7 before …",0,1
6225,0,See you Later ... Tonight Elix Club ( France ) edm edmfam iphone dance edclv plur…,0,1
6227,0,Im so happy that I bought this - christmas xmas bunny samsung calender sam pinkiepie pinkieeye …pic.twitter.com/jhfhP4hz8U,0,1
6229,1,Thanks Apple are great!! FuckYou have storewide someone who speaks Spanish – at Queens Center Mall,0,1
6230,0,Today in london apple car cars iphone photo coches iphone apple amazingcar lamborghini speed sportcar sport deportivopic.twitter.com/zgRcEVkVG5 – at Lamborghini London,0,1
6231,0,I should be studying right now... kindle fun picoftheday bestoftheday likes iphone…,0,1
6234,0,Yesterdayy ^^ me with cousin dinner shwekaung toilet loo hehe mirror phone samsung… -1/,0,1
6235,0,Party with .. chaildren kids arab_foto my_foto sony أطفال سعادة فرح…,0,1
6240,0,.php?pm_controller=gallery&pm_action=viewEntry&d=575 … kuwait q8 pic iphone vote cairo googel youtube sidibouzid Tunisia Vote my pic Dont Forget,0,1
6244,0,Good night vocation newyear trip thailand khaoko a6000 ILCE6000 sony vsco…,0,1
6247,0,Strawberry — Steemit @foxkoit/strawberry … strawberry home nature life art photo photos photography image images gallery sony sonylens sonyphoto sonyphotography sonyphotos sonystory photofeed top feed wow cool follow colors,0,1
6249,0,Happy Birthday Baba! My dad turned 61 today! samsung birthday gift suprisingdad dad…,0,1
6252,0,bigamusic: My New Favorite.. BAM C800G Sony Microphone studiolife music instagood picstitch p…,0,1
6253,0,Happy new year bitchesssss :) me newyear like cute boy me samsung galaxy gay guy…,0,1
6260,0,Are you ready? callOfDuty BOI CoD Play3 PlayStation Sony Games FreeTime relax soGood …,0,1
6263,0,Hailey Baldwin Speaks On Her… news photography fashion health fail tech ipad iphone funny lol,0,1
6278,1,"Who needs a plate? “@andrewprevost: Totally just cut my dinner on my phone screen,, yup that just happened. Sueing apple iphone”",0,1
6284,0,Finally newphone monkey showoff samsung gift butfirst selfie lovingit curlyhairs…,0,1
6287,0,apple suitable for people that are normally allergic to apples! Santanas. Me !! healthy…,0,1
6290,0,just think about it only love it#me my like life hi hello ice iphone photo…,0,1
6292,0,Like and Share if you want this Fast Charger For Iphone iphone sa ... .php/product/pzoz-fast-charger-for-iphone-lighting-cable-original-usb-cabel-for-i6-iphone-6-cable-6s-plus-i5-iphone-5-5s-se-ipad-air-2-ios-10/ …pic.twitter.com/jTffNIVZAM,0,1
6293,0,Harley son baby boy HK smile everything cute instagram iphone ipad followforfollow…,0,1
6295,0,itunes iphone Test your friends boyfriend or girlfriend get scored & find bad out. ThinkYouKnowMe -you-know-me/id543729704?ls=1&mt=8 …,1,1
6305,0,"Keep your phone protected with one of Boost mobiles cases, good for any occasion! Don’t miss out. mobile boost boostmobile phone family case cases iphone androidpic.twitter.com/WUNc9Stjwh",0,1
6313,0,2014 New Year by Sony A7 2870OSS at 종각 보신각 제야의종 33 타종행사 Seoul City Korea 박원순 서울시장님,0,1
6317,0,Samsung galaxy s5! No more Problems with my phone *-* s5 samsung mobile instapic galaxy… -sNMBPieA/,0,1
6323,0,4 yrs anniversary honge juda na hum. This one I really miss sony sonytv indian…,0,1
6324,0,RT boots cat iPhone that's my baby iphone,0,1
6325,0,Weekend weekend picoftheday shoot shooting tfp tfpmodel tfpshooting model modeln camera kamera fun fotografie photography fotograf photograph hobby fotoshooting photoshooting sony sonyalpha sonya6500 KaiEdel artofportrait … pic.twitter.com/0Ey7TMubxe,0,1
6327,1,Seriously Apple? notcool iphone apple fuckyou iphone5s iwantanewphone preorder waitedallnight…,0,1
6330,0,Man im chiling soccer macbook apple chilling like4like instamac itslevels2dis$&@*# …,0,1
6331,0,Photo: Family love Migros & Manor christmas positivity iphonesia popular instagram iphone... -9,0,1
6336,0,On dec ..Martian candy.. kingcrowley king kushking ink iphone loud loyalty pothead producer photooftheday music money model ceo beardgang atx singer songwriting… -qJlp_y/?utm_source=ig_twitter_share&igshid=hk596i1lx8je …,0,1
6343,1,WELL THEN THEY SHOULDNT SAY ITS AN 8G GIVEMETHEIRHEADS VIVALAREVOLUTÍON,0,1
6348,0,“@simply_BreBre: New phone case!! nolenation seminoles iPhone FSU FloridaState thanks to :) ”,0,1
6354,0,"You might not buy the Facebook phone, but your kids will and that’s what matters google Apple",0,1
6356,0,Happy Friday friday life book booklover apple fruit fruitarian fresh…,0,1
6361,0,casper lol look lotd pink aj cap iphone selfie igers instalike instalove local…,0,1
6364,0,"***new blog post*** Yea, I still have a blog. I’m encouraging you to spend more time on your phone. Yup, it can bring marital bliss. Well, maybe. Read why. phone games marriage husband wife iphone apps iphone7 iphone7plus fun blog blogger blogpost readpic.twitter.com/BeLulJKH55",0,1
6371,0,günaydın office nutella supriz samsung istanbul tagsforlike PhotoGrid Samsung…,0,1
6373,0,samsung so much world samsung android low like popular high nice best friend…,0,1
6376,0,Be Happy. ツ XperiaS Xperia InstaXperia InstaSony Instagram SonyXperia Sony Smile Feliz…,0,1
6378,0,Beautiful Sunset ...#sunset crazysunset iPhone Instagram instamazing zen Scotland life …,0,1
6379,0,"My dream came True first time enter to full frame family - SONY A7RIII sony alphaa7riii sonyfamily firsthand fullframe dreamcamera a7riii sonyalphaclub sony Chennai,… ?utm_source=ig_twitter_share&igshid=jxzohfd27zdv …",0,1
6382,0,Crowne Plaza Bruselas fotodeldia instapic pic like picoftheday photooftheday iphone…,0,1
6389,0,Work with what you have and the rest will fall into place • •• • staypositive staystrong building iphonephotography iphonex gloomy saturday motivation feelinggood ?utm_source=ig_twitter_share&igshid=3f1zgvc3xqm4 …,0,1
6399,0,Blinding light. The two little dots at the bottom are my cats eyes  cat igphoto iPhone light,0,1
6401,0,Gain Followers RT This MUST FOLLOW ME I FOLLOW BACK Follow everyone who rts Gain iphone sougofollow zjä},0,1
6409,1,Too bad they can’t figure out the issues with 11.0.3 battery Have too many devices w/too many configs to support!,0,1
6410,0,Snack time . . . . . apple mustard snacktime ilovemustard yummy saturday…,0,1
6412,0,Just like Santa he is always watching! dog dogs pet doglover puppylove petstagram adorable animal pets photooftheday instagood dogs dogs_of_instagram doggy animals petsagram instagramdogs petsofinstagram canine iphonex mobitog apple x ipho…pic.twitter.com/4DBES7M8t0,0,1
6416,0,Gain Followers RT This MUST FOLLOW ME I FOLLOW BACK Follow everyone who rts Gain iphone sougofollow vögv,0,1
6419,0,En el afterwork de yodona con Mery y Melocos !!! follow followme iphone iphonesia… -/,0,1
6426,0,Two Hamiltons to be crammed into… news photography fashion health fail tech ipad iphone funny lol,0,1
6432,0,Chica's desk work macbook apple maps candles sweets simple tv white …,0,1
6434,0,The 3 Musketeers :) Kuwait Family Home Kids iPhone Playtime Christmas Fun Boys…,0,1
6440,0,"Tropical girl, enjoy the beach ヽ(^。^)ノ beach free jogja tropicalgirl samsung instapic…",0,1
6451,0,"The Prophet as a Husband . iphone : android : kindle Book December 18, 2016 a…",0,1
6456,0,This place is my solace lately thankful blessed workout fitfam me iphone 6plus…,0,1
6458,0,Never tired of watching the sky. beautiful autumn sky scenery colorful leafs … IPhone iPAD iOS Appstore LOve Nature IPAD Autumn,0,1
6462,0,"Fin chey , girl kärlek sweet friend amazing chick iphone Gammelstads Pizzeria",0,1
6465,0,Atomium bruselas fotodeldia instapic pic like picoftheday photooftheday iphone instapic…,0,1
6468,0,How You Ain't Know? GanjaGoddess weed i that bad iphone case teamlightskin…,1,1
6469,1,"lost ALL of my effin data! txt msgs, videos from ll cool j & frankie beverly, notes, app data, pix/videos…EVERY EFFIN' THING!!! APPLE",0,1
6470,0,Is Like an App Store? -love-like-an-app-store/ … via iPhone AppStore Comic Funny,0,1
6475,0,"New Phone Sony XperiaZ + New Phone Case American Flag, delivering tomorrow or thursday …",0,1
6480,0,BlendPic:Blend photo - -blendpicblend-photo-prevrati-snimok-v-proizvedenie-iskusstva.html … Андроид Android Games News IOS Apple iPhone,0,1
6483,0,Tales of Maj'Eyal - -tales-of-majeyal-izuchi-kovarnyy-mir.html … Андроид Android Games News IOS Apple iPhone,0,1
6484,0,Yeah! sony XperiaZ smartphone cool black instacool like Z movistar barcelona cool …,0,1
6493,0,New Bikini! :) - apple instagram iphoneonly photo fun party girlfashion…,0,1
6498,0,So much love for this little one!! niece school apple healthy eating her sibling…,0,1
6500,1,Enjoying a morning coffee and working. beenhipster hipster apple coffee…,0,1
6501,0,Heart candle  candle heart lightcandle instagram iphone iphonesia iphoneography picoftheday p,0,1
6505,0,scape from the city and follow the sun selfie iphone camera lol duckface eyes 1d…,0,1
6509,0,Lance Whitney sentiment score is 28.6 . What is yours? +Whitney … cnet Apple pic.twitter.com/8c5nlXjmxn,0,1
6513,0,apple pie cooking yummy sweet apple pie food foodlover dessert instafood…,0,1
6515,0,Halloween gift for friend#Kawaii cute stuff from Minipla Sony plaza Marunouchi…,0,1
6516,0,Out shooting a wedding with my squad! wedding canon sony sonya7rii a7rii…,0,1
6520,0,Super to finally own the entire Hear audio line from Sony (@sonyelectronics)! If…,0,1
6521,0,Finally～～find de WHITE 1~小白 in da house！:D new Samsung A7 notAudi -s4/,0,1
6527,0,Summer blowout!!! Check the website for more . . . . . fashion style beauty likeforfollow forsale shop cute promo iphonex discount art like smile… -HF8sh/?utm_source=ig_twitter_share&igshid=d6nx6m5kj8k4 …,0,1
6529,0,Like and Share if you want this iPhone Food Pattern Case iphone s ... .php/product/for-iphone-7-6-6s-5-5s-se-6s-plus-7-plus-phone-case-cover-rainbow-color-food-hamburger-donuts-macaron-pattern-fundas-cover/ …pic.twitter.com/zglz5CWCWW,0,1
6531,0,What$&@*# 011 - He definitely doesn't have a driver license. - whathe$&@*# bear driver drive news photography video art iphone photo new followme blog instagram inspiration today motivation life japan beautiful nature work fun … pic.twitter.com/qAjCWJtELV,0,1
6534,0,So happy may TFC na kami TFC ABSCBN kapamilya sony kuya_kim TV_Patrol missing_pinas…,0,1
6538,0,InstaPic by mimmo.al: Feb 2016 taken with sony rx100 sunset sky beautiful fun instamoments nature…pic.twitter.com/bhSFS45Stn,0,1
6539,0,Senate fails at passing gun control… news photography fashion health fail tech ipad iphone funny lol,0,1
6541,0,New Case unicorn glitter sony z1 case handyhülle girly glitzer einhorn … -cDR5dAl3o/,0,1
6545,0,Still moving. last load thank God iMac apple maclife JefferyCampbell calilife beauty…,0,1
6547,0,"Kings Canyon, Australia , 8/7/18 . . . like like4like l4l follow followme f4f me cute pic photo picoftheday photooftheday iphone igers tbt photography … ?utm_source=ig_twitter_share&igshid=1a4qxxbxhgzo1 …",0,1
6548,0,Apple Watch is here apple applefan applewatch watch time fan obsessed …,0,1
6550,0,Blues and Greens iphoneonly iphone photooftheday beautiful follow instadaily instagramhub…,0,1
6552,0,"Top iOS news of the week: iPhone sales, no iPad sales, Dropbox : Apple expected to sell 71.5…",0,1
6556,0,Sony Xperia Z2 unboxing handset newphone freeupgrade sony xperiaz2 sexybeast excited…,0,1
6560,0,Just to give a little glimsp of what the scene was like... I took this idea for mlittle801 breezeslc fitness nofilter nice music film camera samsung famous… ?utm_source=ig_twitter_share&igshid=1gey7b4zsikau …,0,1
6563,0,Air New Zealand flight lands safely… news photography fashion health fail tech ipad iphone funny lol,0,1
6570,0,His eyes! mason mammasboy bigeyes gorgeous iphone instapic instababy instafamous…,0,1
6577,1,FBI tracks iPhone users to get personal information and identify them: -and-hacking/20937/fbi-tracking-12-million-apple-device-users-antisec-dumps-digital-dirt-1-million …. Just another reason to hatemac,0,1
6578,0,Like and Share if you want this Totem Phone Case for IPhone iphone ... .php/product/hybrid-totem-henna-soft-tpu-phone-case-cover-for-iphone-7-6-6s-5-5s-se-cute-patterns-mobile-phone-bag-cover-for-iphone-7-plus/ …pic.twitter.com/znowXGYU8P,0,1
6579,0,Save it!!!! rumknuckles rugman look london skateboarding savesouthbank iphone instago…,0,1
6590,0,Got my new phone! iPhone5 apple gadgets electronics cellphone toronto eatoncenter bell…,0,1
6591,0,Thanks for coming to us. customer cute iphone6s light lights wow apple…,0,1
6596,0,"We would like to wish you an amazing day! Make every minute count tls today iphone accessories news life August 06, 2015 at 07:…",0,1
6599,0,"Phone Necessities..Car clips, buy one get 1. Click on Bio-link to learn more. phonecessity iphone samsung amazon shop buynow iphonecase phoneaccessories instagood… ?utm_source=ig_twitter_share&igshid=1atyfafaapbmx …",0,1
6600,0,Watson is a happy puppy puppy mutt lifeproof galaxys5 samsung lifeproofpets sunday… -D0HnPFT/,0,1
6601,0,Like and Share if you want this 3D Phone Case for Iphone iphone sam ... .php/product/2016-new-sweet-3d-mineral-water-bottle-love-ice-cream-phone-case-couples-soft-silicone-rubber-case-for-iphone-7-6-6s-plus-5-5se/ …pic.twitter.com/gGhK0YjBRl,0,1
6602,0,Ebony coffee table final coat. ridgid ryobi trout trump fish iphone apple…,0,1
