id,label,tweet,isVulgar,isNonAscii
1442,0,horses polymer mouth apple scent -mouth-round-ring-jointed-mouth-eggbutt.html … Happy Mouth Round Ring Jointed Mouth Eggbutt,0,1
1444,0,Tengo cof cof !!! . . . boy picoftheday iphoneX instapic instaboy instaguy happiness living goodmorning instagay gaygboy instamoments selfiboy workday en… ?utm_source=ig_twitter_share&igshid=2uoyaaoa7zsp …,0,1
1453,0,"We would like to wish you an amazing day! Make every minute count tls today iphone accessories news life August 22, 2017 at 07:…",0,1
1454,0,So cute my brain is gonna explode! -179461164259537111?gl=sweettoothstudio&rf=238260210081647943 … kawaii apple case pink polka dots smiles fun,0,1
1462,0,30% off phonecases today on Redbubble with the code DAYONE … christmasgifts iphone samsung sale deal offer art horse rat fox cute giftideas GiftIdeasForHer equine animals artist illustratorpic.twitter.com/Cj9ZEt7iLi,0,1
1465,0,Holly Work.... DHA Club Lahore NADA details Apple mac macbookpro Autocad 2d 3D…,0,1
1468,0,Happy new year for everybody! iDavid Sony Xperia M NewYearForEverybody New Year…,0,1
1470,0,new samsung galaxys5 cool fun features The next best thing is already here…,0,1
1473,0,I Love you more than my iPhone! from -love-you-more-than-my-iphone … iphone valentinesday,0,1
1474,0,Shisha time family day two apple it's sunday bad ♡ :D,1,1
1481,0,All that glitters ... cadillac ats coupe bling follow instagood photooftheday beautiful like4like summer fun igers instalike follow hdr iphonex luxury… -ncNAhw9/?utm_source=ig_twitter_share&igshid=1l3p45dfu3cm7 …,0,1
1487,0,Comencemos. me apple new cool insta instaphoto instaphoto follow followme amazing…,0,1
1489,0,ENEE handstand me model igers iphone igdaily instago igaddict instagood hot instamood…,0,1
1492,0,Posing Curiously..!! cute angel cutiepie girlnextdoor curious littleangel xperia sony…,0,1
1494,0,I'm not trying to be cute at all samsung galaxys7 sunglasses girls single…,0,1
1495,0,I loved samsung queen unique instapic pretty fashion georgeous lady look princes…,0,1
1497,0,Today is AppleTurnoverDay ‘A RULE OF CRUMB: Stress cannot exist in the presence of pie’ - David Mamet So true ThursdayThoughts apple turnover earlybiz ukbizhour stress relief freelancer pie earlybiz tweetmaster destress glasgowpic.twitter.com/c6CeNGkDeA,0,1
1501,1,Apple Bunch if Crooks Refused to repair/replace my beats wireless. Problem rubber on mic coming off microphones stopped working. Said warranty was void because ear piece looked chewed. Bullshit. I don’t have any animals and I would chew on anything I put in my ear. pic.twitter.com/GfgvquEpuC,0,1
1508,0,"Customizable Apple, Ipad, Iphone, Iphone6, Iphone7, , Quote, Relationship iPho… pic.twitter.com/OkysKOKabF",0,1
1518,0,$5 Off+Free Shipping society6 iphone cute christmasgift gift christmas ideas sales Namaste yogapants ?promo=K8RYDY6V3HCZ …pic.twitter.com/fwlbJzD9tK,0,1
1522,0,leaves that urban art beautiful picoftheday photooftheday capture iphone foundobjects photo pics …pic.twitter.com/aNfLFuNqek,0,1
1528,0,Gain Followers RT This MUST FOLLOW ME I FOLLOW BACK Follow everyone who rts Gain iphone sougofollow qd)€,0,1
1529,1,"Apple Has Quietly Started Tracking iPhone Users Again, And It's Tricky To Opt Out hatemac hateiphone -apples-iphone-tracking-in-ios-6-2012-10 …",0,1
1534,0,Happy Valentine's Day girl women today valentinesday best apple applewatch…,0,1
1536,0,"We would like to wish you an amazing day! Make every minute count tls today iphone accessories news life January 09, 2017 at 07…",0,1
1537,0,Hello sunny day in NYC apple plaza Manhattan best summer holidays smile …,0,1
1540,0,After heavy rain fall shoutouts indian malayali fun tbt tbs tagging photography iphone… -nFTvAj3/,0,1
1549,0,I Win! win winner instagood instalike this follow saturday weekend success iphonex iphone7plus flowers presson powerful happiness ?utm_source=ig_twitter_share&igshid=yivhqf4tphsn …,0,1
1555,0,Something new — Steemit @foxkoit/something-new … new life home try something story blog life art wow photo photos photography sony sonylens lens sonyphoto sonyphotos sonyphotography photofeed feed art artphotography look follow,0,1
1561,0,Finally a proud owner of this beauty samsung galaxy samsunggalaxys4 new phone girl…,0,1
1562,0,The world has more refugees now… news photography fashion health fail tech ipad iphone funny lol,0,1
1567,0,I don’t have to be pretty to have heart and brain gay instagay selfie iphonex freetime singlegay notshaved ?utm_source=ig_twitter_share&igshid=7cwvyx20vwt …,0,1
1573,0,Yo! This is my gopro gopro gopro3plus sony silveredition 10mpx wide photooftheday … -/,0,1
1574,0,Take a glimpse at my phone ;)) Samsung Softbank . Thanks kay Father :* :* :* fromjapan samsung .php?fbid=507135112678890&set=a.220037171388687.54278.100001472187182&type=1&theater …,0,1
1577,0,Evening vocation newyear trip thailand khaoko a6000 ILCE6000 sony vsco snapspeed…,0,1
1579,0,"Who needs Cupid when you have our 'Love Potion' phone case? Just be careful how you use it... - - - - rogueandwolf, witches, witch, witchythings, witchy, potion, , cool, cutie, cute, cuteaf, goth, gothic, kawaii, iphone, iphone7… pic.twitter.com/ecNCkzMWWD",0,1
1580,0,buy at: -on-fleek?asc=u … redbubble freelance iphonecases iphone onfleek tshirt xmas Christmaspic.twitter.com/8UCzq5WdLh,0,1
1583,0,goofy gym apple iphone fitness russia moscow nice dog гуфи красавчик яблоко good…,0,1
1587,0,One Man Looks for Love on Facebook — Using Ads:... facebook advertising dating facebook_ads Cyber iPhone,0,1
1608,0,Smiles for mammy & daddy :-) baby newborn boy blackandwhite children iphone smile…,0,1
1611,0,Shine wherever you go light shine glow newyear newchapter girlpower iphonex…,0,1
1613,0,just got my brand new AppleTV and i´m amazed that this great piece of hardware married such a beautiful software awesome apple,0,1
1614,0,Luxury Fundas Woo... and much more at Zeta Supplies. Click the link - -fundas-wood-case-for-iphone?utm_campaign=social_autopilot&utm_source=tweet&utm_medium=tweet … iPhone discount case,0,1
1619,0,"The Prophet as a Husband . iphone : android : kindle Book January 31, 2017 at…",0,1
1621,0,The Atlantic Daily: Refugee… news photography fashion health fail tech ipad iphone funny lol,0,1
1622,0,Totally in love ♡ samsung galaxy s3 white phone christmas present parents …,0,1
1625,0,my boys! girl me directioner cute instadaily instapic instagood instamood iphone… -SAv7q4/,0,1
1626,0,"Just got rimmed by Apple, £65 for a new charger cos the one they sent me broke",0,1
1628,0,Bored lol lol bored outside new young wild fun free laugh iphone instagood instalike…,0,1
1629,0,Wheelbarrow rides are always a big hit. • • • • • livediff livedifferent dominicanrepublic picoftheday iPhone kidsjustwannahavefun wheelbarrow memoriesfromthedr lifeisaboutpeople iPhoneX nofilter ShotoniPhone launion pic.twitter.com/R3QGPyysI8,0,1
1631,0,"My iphone starts falling apart - earlier I was still thrilled about an useful app, now I’m quite irritated by backcover cracking -hate",0,1
1632,0,Nothing like the wind in my fur . iphonex 4k dog dogs dogsofinsta dogsofaustin dogsoﬁnstagram atx atxdogs puppy pupper doggo pup instapic instadog picoftheday austin austin360 life travel wanderlust smile art paws sit handsome videopic.twitter.com/OjqPwqDzEJ,0,1
1633,0,20th anniversary sony playstation thankyou for the gamingexperience you gave to humanity…,0,1
1635,0,Comedian Paul Scheer & His Wife… news photography fashion health fail tech ipad iphone funny lol,0,1
1644,0,Now Available - Hoodie. Check it out here - -1?utm_campaign=social_autopilot&utm_source=tweet&utm_medium=tweet … iPhone case music discount,0,1
1650,0,Spring time has started and it’s time for those picture perfect moments to be captured with the Samsung Galaxy J3 Emerge • • • •#spring easter samsung galaxy picture phone phonecase monday boost boostmobile tampa tampabaypic.twitter.com/giIj34N2DY,0,1
1652,0,First iPhone to iPhone6 plus ! birthday Steve jobs _birthday_Steve_ jobs apple…,0,1
1656,0,When dreams come true. macbook macbookpro apple amore amour felicitá happiness…,0,1
1657,0,Asleep in the train. photography photooftheday iphone mythreesons family amtra… pic.twitter.com/Z3AbxQ67pa,0,1
1658,0,Home — Steemit @foxkoit/3tacw7-home … home story blog life art artphotography artphoto photo photos photography image images gallery sony sonylens lens sonyphoto sonyphotos sonyphotography sonystory follow wow photofeed feed top colors blue sky,0,1
1660,0,Jet Black!!! apple iphone iphone7 look like4like me tbt instalike instagram…,0,1
1661,0,Gain Followers RT This MUST FOLLOW ME I FOLLOW BACK Follow everyone who rts Gain iphone sougofollow a£6ä,0,1
1666,0,Get A FREE iPhone 8 From Sprint and AT&T apple iphone8 bestdeal gooddeal bogo att great tech buy -a-free-iphone-8-from-sprint-and-att/ …pic.twitter.com/yiGifR6Tbg,0,1
1668,0,Gain Followers RT This MUST FOLLOW ME I FOLLOW BACK Follow everyone who rts Gain iphone sougofollow a£ä},0,1
1669,0,Waiting Ilmi with samsung gadget android galaxytab2 galaxymini indonesia browsing note…,0,1
1674,0,coffee time shoot shooting tfp tfpmodel tfpshooting model modeln camera kamera fun fotografie photography fotograf photograph hobby fotoshooting photoshooting sony sonyalpha sonya6500 KaiEdel artofportrait makeportra… pic.twitter.com/BWDiogEHdx,0,1
1679,0,redhair red loca me kim addicted hair#photoaday iphone igaddict instahub…,0,1
1680,0,Fox sagar lake...!! Mobile view arts iPhone 6s flowers makeup like4like…,0,1
1683,0,here you go your order is ready󾌳! samsung s4 custommade covers eid everyone! scribbles...,0,1
1687,1,Photo: life is … ? girlincast crutches macbookair work coffee milk apple vegs sick stuck...,0,1
1688,0,It's a good day . . . blessed good day nature apple computer technology …,0,1
1691,0,Cavern vocation newyear trip thailand khaoko a6000 ILCE6000 sony vsco snapspeed…,0,1
1692,0,Jim Goldman sentiment score is 35.9 . What is yours? +Goldman … technews Apple pic.twitter.com/nLaXAuFwaH,0,1
1693,0,That moment when an apple makes you so bottlerock napa livemusic stoked girlboss…,0,1
1695,0,WORLDHEALTHDAY • detox tea • chicken + apple salad + spinach • pb + j cup • {100% ORGANIC} tampapic.twitter.com/MzmtEOtArA,0,1
1706,0,durian friends manggabesarjakbar jakarta camera360 samsung '3-4 Agustus 2013' with…,0,1
1707,0,World's Safest Bar ?fm=twitter … newsdict news Digital Intro iPhone iPad Samsung pic.twitter.com/C4E2IqEeWT,0,1
1708,0,You And Me.. iPhone iPhone6 iPhone6Plus Apple you and me teamo amo waiting…,0,1
1714,0,Happy Wednesday everyone! Live it up and it upppp! (And share the love with a new iPhone case hehe) -iPhone-Wallet-Focus-Leather/dp/B07C4SQ6JY …,0,1
1715,0,Now this is a hustle. Amazing men crazy iphone hits_series instamood kiss…,0,1
1720,0,Birthday present! :)) apple. iphone. 5. white. itunes. birthday. present. . new. texas.…,0,1
1723,0,"Portrait mode on iPhone, Practically magic! NewYork throwback photooftheday SeaSide …",0,1
1725,0,My Phone Samsung Note3 Cute FollowMe Haha InstaGood Likeforlike Me Photooftheday…,0,1
1733,0,Canary Islands Landscapes canaryislands canarias light landscape winter instagood iphone…,0,1
1740,0,Iphone USB Cable -IPHONE-USB-CABLE-/332162504946 … iphonecable iphone nationalpetday freeshipping ebay Advertising Marketing promotion,0,1
1747,0,3 in 1 charger cable ebay amazon .uk/itm/-/112600020803 … etsy MakeASongSingle Barry Bennell EuropaLeague RedDwarf30 GunReformNow David Ospina Gold Town gamesinmovies Chinese New Year Mary Lou McDonald food cooking idea technology Samsung iPhoneXpic.twitter.com/e8dydtEvOr,0,1
1754,0,Studying for Business and Tourism laptop sony screen easysubjects smile eyes Home Sweet…,0,1
1769,0,Two Smartphone Kings – Pros & Cons For Real (Part II – Galaxy Note 8) samsung ios android iphone note8 awesome camera resolution fingerprint tech smartphones mobile maps ly gaming samsungpay applepay androidpay music -smartphone-kings-pros-cons-for-real-part-ii-galaxy-note-8/ …pic.twitter.com/B0oHxN4wrG,0,1
1771,0,"But first, let me take a selfie Paris frankreich france photography photo pic picoftheday foto fotografie guru gutushots instagroove smile sony sonyalpha… ?utm_source=ig_twitter_share&igshid=jzzcefdsgbx5 …",0,1
1777,0,Picture in Picture! rosengarten spring holiday lifestyle lastday april sun iphone…,0,1
1778,0,My new phone finally arrived :-D Z3 sony smartphone newstuff like follow instabest…,0,1
1782,0,15% off! code: WHY15 -wave-mandala?asc=u … mandala redbubble freelance iphonecases iphone tshirt mondaymotivationpic.twitter.com/lQ33UKrSmn,0,1
1783,0,Why I Have Gone Back To An iPad Apple phone tech technology news Science automobile Latest -i-have-gone-back-to-ipad.html …,0,1
1785,0,Massive sale iPhone Tempered Gl$&@*# 7/8 and 7/8 Plus follow us iphone…,0,1
1795,1,¿Me lo dices o me lo preguntas Apple ? Ya mi teléfono funciona solo conectado a la electricidad. Do you tell me or do yo ask me apple ? Now my iPhone works only connected.Have you asked yourself if you were in a bad economic situation could you pay a new phone? apple …,0,1
1800,0,我好看么 oneplus_official oneplus_gallery by Shaw's OnePlus 3t miss oneplus…,0,1
1804,0,"Much ado about a hairdo, Francois… news photography fashion health fail tech ipad iphone funny lol",0,1
1808,0,Sexy Saturday XD redbull energydrink ipod instago instagood mobile samsung galaxyace…,0,1
1821,0,Mini-crumbles *-* Homemade Crumble Apple Strawberry Cooking Montreal Summer Holidays…,0,1
1829,0,Everything || joy peace reflect remember sky cloud cloudhub skyhub tree gr$&@*# iphone…,0,1
1831,0,Yaa$&@*# apple store munich photography iphoneonly instagood iphone ipad imac cool…,0,1
1835,0,mini apple autumn vscocam vsco lutsk sweethome mmm fruits home Ukraine Україна… -GCXjDOM/,0,1
1836,0,Warriors will have to work hard to… news photography fashion health fail tech ipad iphone funny lol,0,1
1837,0,Photo: Wow it’s about time!!! LOLLIPOP!!! android 100happydays update motorola moto4g motog,0,1
1838,0,"New phone, its a bit of a beast! massivephone samsung note2 bigphone love toogood…",0,1
1839,0,- TAG YOUR FRIENDS design contemporary architecten architect arquitectura iphone mimar mimarlık araba car cars instaarchitecture concept Architektur architecture luxury archite…,0,1
1842,1,"The downside of owing an is the horriblewaittimes when you need help#stupidiphonestore I’m switching to android cantstandthewait#breakup – at Apple Store, Uptown",0,1
1845,0,I love my grandma's mirror :) mirror smile bathroom alone samsung chicago bulls red…,0,1
1848,0,Happy . . . maserati maseratilevante smile selfie selfies follow note8 samsung…,0,1
1856,0,InstaPic by mimmo.al: Feb 2016 taken with sony rx100 sun sky beautiful fun instamoments nature f…pic.twitter.com/elfiRMt14v,0,1
1858,0,RT … Never miss the moment SonyA58 Sony SonyPH DSLR photography moments life … pic.twitter.com/rCGLFHviBQ,0,1
1861,0,Enjoy today. girl brunette sunglasses blog blogger like tuesday vsco iphone vegan fit healthyli… -f/ pic.twitter.com/VyNw6Co11R,0,1
1869,0,"Samsung Galaxy S III Mini ?ie=UTF8&camp=213733&creative=393177&creativeASIN=B009PLBLQC&linkCode=shr&tag=httpstwitter.comlindsaytweets1-20 … via I cell phones, computers, facebook BatesMotel, Shopping xxoo M",0,1
1870,0,New Phone :) samsung android teamandroid hvite cool yeey tagsforlikes me…,0,1
1871,0,Chocolate my favorite Starbucks apple edm dj edm goals focus fountainofyouth … -dEr9owads/,0,1
1874,0,Family cmarie723 family friends beauty fun cuties iphone iphoneisa foreveryoung hookahbar…,0,1
1880,0,"Haha, inshot sisters best eyes editing samsung camera fools like4like lol…",0,1
1881,0,Keep pushing • • • fitnessjourney crazywrapthing itworks life style smile iphone …,0,1
1882,0,best friend gift samsung cover golden Im so i love my… -zq2LovfMRYyAsYhC3lXUyXxu_5EgBTtxDcEk0/ …,0,1
1887,0,Went apple picking at Carter Mountain with the babe charlottesville apple nature mountaind …,0,1
1892,0,I’m Pretty Sure These Orangutans… news photography fashion health fail tech ipad iphone funny lol,0,1
1896,0,T-Shirt and much more at Zeta Supplies. Click the link - -shirt?utm_campaign=social_autopilot&utm_source=tweet&utm_medium=tweet … iPhone discount case,0,1
1899,0,A few mins before my previous post iPhone video beach storms cell photographer…,0,1
1905,0,Mama got a new phone... be prepared for portrait mode overload iphonex portraitmode dog dogs dogsofinsta dogsofaustin dogsoﬁnstagram atx atxdogs puppy pupper doggo pup instapic instadog picoftheday austin austin360 life wanderlust potdpic.twitter.com/NFib39Tue9,0,1
1906,0,"Fuck you envious, you can only suck my cock. tattoo apple i-phone obey-clothes metal…",0,1
1907,0,"You're my Angel, come and save me tonight.. ilovemydogs iphone pomeranian pommymommy …",0,1
1909,0,Achi's favorite. She's gonna die for sure. samsung live laugh life kinder dxb…,0,1
1913,0,"We would like to wish you an amazing day! Make every minute count tls today iphone accessories news life April 11, 2017 at 07:0…",0,1
1914,0,.php?pm_controller=gallery&pm_action=viewEntry&d=575 … kuwait q8 pic iphone vote cairo googel youtube sidibouzid Tunisia Vote my pic Dont Forget.,0,1
1915,0,"This evening, from my window.. by my Sony today Saturday holiday sea Sky…",0,1
1919,0,"The Prophet as a Husband . iphone : android : kindle Book January 10, 2017 at…",0,1
1924,0,5/5 Star Rated Apple MacBook Air =as_li_tl?ie=UTF8&tag=love058b-20&camp=1789&creative=9325&linkCode=as2&creativeASIN=B01EXFDDWO&linkId=09c753e42b04cafb66bb5676049a7cb8 … New Mac Apple Ios Tech Music News Iphone Itunes Apps Ipad RT pic.twitter.com/Bp3Mt0TLLY,0,1
1925,0,chorizo apple sausage roll i made this nice pastry apple chorizo new different random…,0,1
1926,0,We are to announce we are now doing iPhone 6s apple screenreplacement only £99.99 …,0,1
1932,0,Use Google Assistant on Your iPhone Even If It's Not On the Foreground siri apple ios iphone ipad smartphones mobile tech info howto nice google googleassistant googlemap youtube netflix nice productivity efficiency -google-assistant-on-your-iphone-even-if-its-not-on-the-foreground/ …pic.twitter.com/izdWurkUzX,0,1
1934,0,& Forever and Ever 4ever forever you bästatjejenihelavärlden iphone4 iphone i,0,1
1937,0,im so happy mac apple bulbasaur pokemon pikachuplaster bandeges plaster Twinings…,0,1
1939,0,Old iPhone new case:25% off using code SWEETCASE25 Sidney summer wildlife outdoor AUS peak neverland-finding-without-seeking?asc=u&p=iphone-case&rel=carousel …,0,1
1940,0,One more selfie summer feeling clothes fashion vlog vibes apple mirror hipster…,0,1
1948,0,New game yay need for speed most wanted sick game playstation 3 ps3 sony…,0,1
1950,0,Learn how to p$&@*# level 6 of the Happy Basketball Game by AppAltas. Happy Basketball Game is available on the App Store. -basketball-game/id1369059658 … AppAltas App game level6 basketball block win ios iphone iphonex ipad ipadpropic.twitter.com/KO6nmjnfTl,0,1
1951,0,New Year Goals DSCT5 SONY Lip RearLip TrunkLip Mods Honda NewYear YOLO…,0,1
1955,0,RESTOCKED!!! sale iphone phonecover accessories fashion blogger summer sun beach…,0,1
1957,0,Plants vs. Zombies 2: It’s About Time - -plants-vs-zombies-2-2-aya-voyna-rasteniy-protiv-zombi-nachinaetsya.html … Андроид Android Games News IOS Apple iPhone,0,1
1958,0,Happy Dog — Steemit @foxkoit/happy-dog … dog day warm summer life art photo photos photography image gallery photofeed feed sony sonylens sonyphotography follow new top blog story,0,1
1962,0,Thank u Jolly 'ol St. Nick#macbookpro christmasgift apple holidays …,0,1
1963,1,Trump Attacks a “Mexican” U.S. Federal Judge news photography fashion health fail tech ipad iphone f…pic.twitter.com/g5kSWwAh7M,0,1
1969,0,ally$&@*# knows my stoned face soo jokes skunkweed iphone samsung note2 htc …,0,1
1971,0,The world needs more forgiveness –… news photography fashion health fail tech ipad iphone funny lol,0,1
1974,0,Live | Laugh | Love GodIsGood Blessed instagood picoftheday sony jesflix jeep …,0,1
1980,0,Happy Birthday Vahid! Take care always. We miss you! malaysia samsung live laugh…,0,1
1982,0,Special App For valentine >> ?mt=8 … photography nowplaying daughter poem valentineapp iphone любовь 411,0,1
1985,0,That kid by the window. instagood tbt photooftheday instamood iphonesia iphone…,0,1
1992,0,Beauty Shopping AliUSAExpress iPhone ios app Xiaomi Redmi 3S Dual SIM LTE – 16GB Factory Unlocked S...,0,1
1994,0,upgraded iphone6 iphone upgrade phone new technology earlypresent christmas xmas…,0,1
1997,0,Hunt — Steemit @foxkoit/hunt … hunt garden new life home story blog photo photos photography image images wow sony sonylens sonyphoto sonyphotography sonyphotos follow nature A,0,1
2002,0,Gain Followers RT This MUST FOLLOW ME I FOLLOW BACK Follow everyone who rts Gain iphone sougofollow ö/[t,0,1
2005,0,I had a bad day...but I feel better now! iphone 6s apple newphone rosegold sexy…,1,1
2007,0,It's a great day for HOCKEY LETS GO bruins !!! sky apple iphone4s igers…,0,1
2013,0,Could Someone Unseat Sen. Chuck… news photography fashion health fail tech ipad iphone funny lol,0,1
2014,0,horses dee mullen mouth apple scent space age polymer -mouth-shaped-mullen-king-dee-bit.html … Happy Mouth - Shaped Mullen King Dee Bit,0,1
2017,0,Headphones on with BrigadaBeats​​ in the background writing the pain away. LifeMusic Chardonnay Iphone Pain Music & Life,0,1
2018,0,Waiting for my gram. Boredddddd.. TheWalkingDead waiting bored iphone teamiphone iphone5 …,0,1
2024,1,People won't pay ₹18000 for shit. offers so much better phones in the same price range. VIVOSucks.,0,1
2026,0,➊ FOLLOWTRICK ➋ RETWEET ➌ FOLLOW ALL WHO RT ➍ FOLLOWBACK ➎ GAIN TODAY iphone sougofollow £86l,0,1
2027,0,"The Prophet as a Husband . iphone : android : kindle Book March 18, 2017 at 1…",0,1
2028,0,Awesome video made on iPhone 6 ?v=ZUDGG4Z-WIQ … iphone ios video amazing travel europe edge landscape history couple pic.twitter.com/GYgA3DkJpp,0,1
2030,1,Samsung Galaxy Note 7 Blast Official Samsung Report -samsung-galaxy-note-7-blast … samsung note7 samsungphoneblast samsungmobilepic.twitter.com/kr5ztS7pzV,0,1
2034,0,Yay now they match! sexy superman marvel earphone phonecase iphone classic…,0,1
2043,0,The new toy.... the new baby.... laptop tablet sony vaio amazing picture seattle…,0,1
2047,0,Gain Followers RT This MUST FOLLOW ME I FOLLOW BACK Follow everyone who rts Gain ff iphone sougofollow ö1£v,0,1
2053,0,beautiful sunset at the bunakenchacha the sun going down iphone nature natgeo…,0,1
2055,0,Just our Narsis Face lol iphone iphonesia iphoneonly iphonography cartoon fashionstyle…,0,1
2057,0,"My Photo ""Joy Rich"" -rich-by-chaz-wright?utm_medium=twitter&utm_campaign=nativeshare&utm_content=web&utm_source=500px … japan japanese blackandwhite monochrome streetphotography laughing sonya7s sony",0,1
2059,0,18 years old papa. samsung live laugh life filchi chinese instago instahub…,0,1
2071,0,Like and Share if you want this iPhone Food Pattern Case iphone s ... .php/product/for-iphone-7-6-6s-5-5s-se-6s-plus-7-plus-phone-case-cover-rainbow-color-food-hamburger-donuts-macaron-pattern-fundas-cover/ …pic.twitter.com/akHfWnSArb,0,1
2072,0,Rose party rose music goodvibes samsung sony sonybrasil canon canonbr…,0,1
2078,0,Love is in the air couple uk birmingham chinatown igdaily igers iphone iphonesnapshot…,0,1
2080,0,[$2.30] Funny Emoji House Slippers! -emoji-house-slippers-1845 … aliexpress cheap shopping deal sale deals offer amazing emoji funny blessed slipperday2018 house laugh lol life apple girl fun time movie heart face emojis,0,1
2081,0,MORNING // them pretty girly pink iphone gold rose ysl lifestyle…,0,1
2083,0,Ieiiiii and my new toy just arrived iphone X newtoy iphonex newphone newphone ieiii…,0,1
2096,0,Off to school mine apple water bfast goodvibes girl kid fun smile instashot…,0,1
2097,0,Benghazi Victim’s Widow BLASTS… news photography fashion health fail tech ipad iphone funny lol,0,1
2101,0,Home to fairies -smiling-mushroom?asc=t … via fungi pun funny cute adorable cartoon emoji painting illustration drawing redbubble shirt phonecase galaxy samsung android iphone laptopcase pillow bag totebag decor stickers notebook journal,0,1
2104,0,I love playing the guitar explore enjoylife friends party 90s nofilter iphone…,0,1
2110,0,new year 2014 cheerful fun smile sweet couple S&M sony maya black party new day..…,0,1
2111,0,Love my new iPhone case minion mickey fun 4s funda lopeta lomás bestcaseever,0,1
2112,0,High way cafe...... shoutouts indian malayali fun tbt tbs tagging photography iphone…,0,1
2113,0,Romantic Night kent sky romantic beauty clouds colour exotic iphone igers nature…,0,1
2114,0,"The Prophet as a Husband . iphone : android : kindle Book February 24, 2017 a…",0,1
2116,1,I LoveApple but the terrible latest iOS update pushes me to . Losing signal constanstly -signal-loss-no-service-problem-in-iphone/ …,0,1
2118,0,Birthday Cake!!! apple birthday wish julieday sweet healthy meow green…,0,1
2133,0,Apple is Totally Changing the International Data Roaming Game what are you waiting for? -sim-cards-data-roaming?adbpr=16211434&xid=social_20150704_48629396&adbid=617295056236490752&adbpl=tw …,0,1
